{
 "$schema": "https://json-schema.org/draft/2020-12/schema",
 "title": "registry/allowed-tex.json",
 "type": "object",
 "additionalProperties": false,
 "required": [
  "allowed",
  "allowed_prefixes",
  "definition_environments"
 ],
 "properties": {
  "comment": {
   "type": "string"
  },
  "allowed": {
   "type": "object"
  },
  "allowed_prefixes": {
   "type": "array",
   "items": {
    "type": "string"
   }
  },
  "definition_environments": {
   "type": "array",
   "items": {
    "type": "string"
   }
  }
 }
}
