{
 "comment": "OWNER OF MATH-MODE COMMANDS. Control words that content and definition bodies may use inside mathematics without a registry entry: amsmath layout, relations, bound-variable Greek letters, accents, and the structural macros of latex/tpc-macros.sty. Greek letters and glyphs that the registry owns (\\mu, \\rho, \\Delta, \\Omega, \\sigma, ...) are deliberately absent: content must use the semantic macro. This file does NOT list text-mode constructs: sectioning, environments, text macros (\\emph, \\ref, \\claim, \\tpcdef, ...), the switch \\text and the forbidden list (\\input, \\cite, \\includegraphics, \\tag, ...) are owned by docs/authoring/contract.json and enforced by scripts/course/check_levels.py. check_registry.py reads the contract's text macros from there and fails ('allow-list conflict') on any word listed here that the contract owns or forbids. allowed_prefixes is empty for the same reason: a prefix would admit \\tpcsetchapter and \\tpcdeclaredef, which the contract forbids in content.",
 "allowed": {
  "math layout": [
   "frac",
   "tfrac",
   "dfrac",
   "sqrt",
   "sum",
   "prod",
   "int",
   "oint",
   "lim",
   "limits",
   "nolimits",
   "left",
   "right",
   "big",
   "Big",
   "bigg",
   "Bigg",
   "bigl",
   "bigr",
   "Bigl",
   "Bigr",
   "biggl",
   "biggr",
   "quad",
   "qquad",
   "mathrm",
   "mathbf",
   "mathit",
   "mathcal",
   "mathbb",
   "mathsf",
   "mathfrak",
   "boldsymbol",
   "operatorname",
   "overline",
   "underbrace",
   "overbrace",
   "binom",
   "notag",
   "substack",
   "colon",
   "cdots",
   "vdots",
   "ddots",
   "displaystyle",
   "textstyle",
   "scriptstyle",
   "phantom",
   "hphantom",
   "vphantom",
   "mathstrut",
   "hline",
   "input",
   "emph"
  ],
  "relations and operators": [
   "cdot",
   "times",
   "leq",
   "geq",
   "le",
   "ge",
   "neq",
   "ne",
   "approx",
   "equiv",
   "sim",
   "simeq",
   "cong",
   "propto",
   "ll",
   "gg",
   "in",
   "notin",
   "ni",
   "subset",
   "subseteq",
   "supset",
   "supseteq",
   "cup",
   "cap",
   "setminus",
   "emptyset",
   "varnothing",
   "to",
   "mapsto",
   "rightarrow",
   "leftarrow",
   "Rightarrow",
   "Leftarrow",
   "Leftrightarrow",
   "leftrightarrow",
   "longrightarrow",
   "implies",
   "iff",
   "forall",
   "exists",
   "infty",
   "partial",
   "nabla",
   "otimes",
   "oplus",
   "bigotimes",
   "bigoplus",
   "dagger",
   "pm",
   "mp",
   "circ",
   "ast",
   "star",
   "perp",
   "parallel",
   "mid",
   "langle",
   "rangle",
   "lvert",
   "rvert",
   "lVert",
   "rVert",
   "lbrace",
   "rbrace",
   "vert",
   "Vert",
   "prime",
   "angle",
   "restriction"
  ],
  "named functions": [
   "cos",
   "sin",
   "tan",
   "cot",
   "exp",
   "log",
   "max",
   "min",
   "sup",
   "inf",
   "dim",
   "det",
   "ker",
   "arg",
   "deg",
   "gcd",
   "lim",
   "Re",
   "Im"
  ],
  "bound-variable greek": [
   "alpha",
   "gamma",
   "delta",
   "epsilon",
   "varepsilon",
   "zeta",
   "theta",
   "vartheta",
   "iota",
   "kappa",
   "lambda",
   "nu",
   "xi",
   "pi",
   "varpi",
   "phi",
   "varphi",
   "psi",
   "Phi",
   "Psi",
   "Lambda"
  ],
  "accents": [
   "hat",
   "widehat",
   "tilde",
   "widetilde",
   "bar",
   "vec",
   "dot",
   "ddot",
   "check"
  ],
  "legacy structural macros of tpc-macros.sty": [
   "ket",
   "bra",
   "ketbra",
   "expval",
   "melem",
   "abs",
   "norm",
   "set",
   "vb",
   "uv",
   "pd",
   "td",
   "dd",
   "grad",
   "R",
   "C",
   "Z",
   "N",
   "Rn",
   "Cn",
   "supp",
   "id",
   "vspan",
   "diag",
   "sgn",
   "real",
   "imag",
   "rank",
   "im",
   "argmax",
   "argmin",
   "herm"
  ]
 },
 "allowed_prefixes": [],
 "definition_environments": [
  "definition",
  "prototypedefinition"
 ]
}
